"Must-know: Twitter stock has been hot, but is it a good deal? Twitter stock as appreciated rapidly since its recent IPO, but is it worth the price? Find out why we think Twitter is a bad deal. http://finance.yahoo.com/news/must-know-twitter-stock-hot-193451595.html Must-know: Twitter stock has been hot, but is it a good deal? - Yahoo Finance Must-know: Twitter stock has been hot, but is it a good deal? December 30, 2013 2:34 PM Why Twitter is like the cronut—in demand, but hyped and overvalued (Part 1 of 5) One of the buzziest topics in the investing world lately has been Twitter (TWTR). The social media company was one of the most sought-after IPOs of the year as the stock popped to $44.90 per share on its first trading day, after the IPO priced at $26 per share. Since then, the stock has had a strong rally and closed on December 20, 2013, at $63.75 per share, resulting in a market cap of over $36 billion. However, the market’s perception of Twitter’s valuation is far beyond the company’s fundamental valuation. We’re not saying the stock will decline in price, but we can say that where it’s priced is probably not what it’s worth, and that relative to its comps, Twitter is probably too expensive. Read on to find out why we think Twitter is a bad deal from both a relative and absolute value perspective. Continue to Part 2 Browse this series on Market Realist: Part 2 - What is Twitter? An investor’s guide to the company and service Part 3 - Why Twitter is like the cronut: It’s all about the hype Part 4 - Why Twitter could trade up even if the fundamentals don’t support it Anthem to raise some premiums as much as 25% Up to 306,000 Californians with older, individual Anthem health insurance policies — unchanged by Obamacare — are subject to the rate increases. Japan logs rises in inflation, factory output TOKYO (AP) — Japan's consumer price index rose 0.4 percent in 2013, the first increase in five years, in further evidence the recovery in the world's third-largest economy is gaining momentum. Credit Cards Are Now Offering 0% APR Through 2015 Consumers can now get rid of high interest rates and get 0% APR for 18 months. Compare these leading 2013 credit card offers and find your best offer. AdChoices Economy grows at 3.2% pace in fourth quarter The economy grew at a solid 3.2% annual rate in the fourth quarter. Daimler Fits V-Class Van With Features for S-Class Sedan Daimler AG (DAI) , the world’s third-biggest luxury-car maker, will equip its new Mercedes-Benz V-Class model with features from the flagship S-Class sedan to support a plan to increase van deliveries almost 60 percent. Daimler, also the world’s biggest truckmaker, set a target in 2012 of selling… A Holiday Surprise: Amazon Growth Slows Amazon reports fourth-quarter net income of 51¢ per share—below analyst estimates of 69¢—after growth in foreign sales halved the U.S. rate Let Ilumina brighten up your portfolio The company that Angelina Jolie Pitt made famous was a great stock before she brought attention to it, and it’s still a great stock now. [video] Why is oil surging as stocks slide? What's behind the recent rise in oil prices? Is $100 oil coming back? With Stephen Shork, The Shork Report, CNBC's Bertha Coombs and the Futures Now Traders. [video] Forget the January effect -- stocks look strong: Strategist Nicholas Colas of ConvergEx explains why equities still look well-positioned for gains in 2014, with CNBC's Bertha Coombs and the Futures Now Traders. Google's Intellectual Gain From Motorola Google Inc.'s $2.9 billion deal to sell the hardware business of phone maker Motorola Mobility, a company it bought for $12.5 billion two years ago, is being described by some as a sign of failure. True, there's a lot that looks silly now about Google's effort to enter the mobile-handset market. … [video] Million Dollar Homes: Steelers vs. Colts CNBC's Eamon Javers provides a tour of ""Window Wonder,"" while Morgan Brennan shows off the ""Brick Behemoth"". Super broker Dolly Lenz shares her pick of the best $1 million value. Visa’s Scharf Says Traditional Payment Networks Trump Bitcoin Visa Inc. (V) Chief Executive Officer Charlie Scharf said he’s more confident in traditional payment networks than in virtual currencies like Bitcoin. “There are certainly some interesting things about ... BofA Should Pay $2.1 Billion in Fraud Case, U.S. Says Bank of America Corp.’s Countrywide unit should pay the maximum penalty of $2.1 billion for defective mortgage loans it sold to Fannie Mae and Freddie Mac in the run-up to the 2008 financial crisis, federal prosecutors told a judge in a court filing. U.S. District Judge Jed Rakoff in Manhattan is… Men’s Wearhouse Willing to Raise Offer for Jos. A. Bank Men’s Wearhouse, in a letter to the board of Jos. A. Bank released on Thursday, reiterated its offer to buy Jos. A. Bank at $57.50 a share, but added that “we are prepared to increase our offer price” ... China Panel Makers Turn Solar Farmers to Counter Glut China’s solar-panel makers are investing more in building their own power projects, expanding sources of revenue and soaking up some of the manufacturing capacity that depressed panel prices. The push is being led by companies such as Yingli Green Energy Holding Co. (YGE) and Shunfeng Photovoltaic… How You Can See Anyone's Public Record in Seconds Did you know that your pubic record is online for anyone to see? Search anyone and you can see marriages, bankruptcies, licenses, and more. AdChoices [video] Tapering is a 'good move': Pro Michael Yoshikami, founder and CEO of Destination Wealth Management, says it's encouraging to see the U.S. Federal Reserve continue to taper and it will benefit U.S. and European equities. [video] College football system is dysfunctional: Steinberg Discussing the stock market, paying college football players and Super Bowl XLVIII, with Jack Brewer, The Brewer Group CEO & founder; Leigh Steinberg, Steinberg Sports & Entertainment CEO; and Seattle ... On the Call: Altria Group CEO Marty Barrington Altria Group Inc., the owner of the biggest U.S. cigarette maker, Philip Morris USA, continues to focus its efforts on building its premium Marlboro brand which has been under pressure from competitors ... US economy grew at 3.2 percent rate in Q4 WASHINGTON (AP) — The U.S. economy grew at a 3.2 percent annual rate in the October-December quarter on the strength of the strongest consumer spending in three years, an encouraging sign for 2014. [video] What emerging threats mean for your money Mad Money host Jim Cramer looks at how emerging markets impact U.S markets and urges investors to be patient for opportunities could be ahead. Emerging-Market Tremors Shake the World Economy From Asia to South America, developing nations are in turmoil Stocks slammed! Official 'correction' looms NCAA fumbles, college football team wants to unionize Super Bowl ad strategy goes bigger than game day The problem with Microsoft's next CEO Keystone review looming, likely to show little climate risk No Terrible Twos for Facebook stock Google Stock Touches New High As Ad Clicks Climb Seahawks vs Broncos: which Super Bowl team is Wall … NCAA fumbles, college football team wants to union … Stocks slammed! Official 'correction' looms Bird flu negative for YUM stock: Trader MasterCard's Q4 Revenue Jumps, but Wall Street … © 2013 Market Realist, Inc. and subject to the Terms of Use on <a href=""http://www.MarketRealist.com"">www.MarketRealist.com</a>,data/hw_hotel_finance/finance\2014_01_31-PM_00_05_12-1.txt"
"Secondary Offerings at JinkoSolar, Shutterstock Send Shares Higher It is not often that a secondary stock offering sends a company’s shares higher, but we are seeing that very phenomenon Friday morning. Chinese solar PV maker JinkoSolar Holding Co. Ltd. (NYSE: JKS) and ... http://finance.yahoo.com/news/secondary-offerings-jinkosolar-shutterstock-send-161000001.html Secondary Offerings at JinkoSolar, Shutterstock Send Shares Higher - Yahoo Finance Secondary Offerings at JinkoSolar, Shutterstock Send Shares Higher September 20, 2013 12:10 PM It is not often that a secondary stock offering sends a company’s shares higher, but we are seeing that very phenomenon Friday morning. Chinese solar PV maker JinkoSolar Holding Co. Ltd. ( JKS ) and stock image company Shutterstock Inc. ( SSTK ) both priced secondary offerings this morning and shares in both companies have risen sharply. At JinkoSolar, shares priced at $16.25, after closing Thursday night at $16.48, and shortly before noon the stock was up by 13.8% at $18.75. The company offered 3.8 million shares and an underwriters’ option on an additional 570,000. JinkoSolar says it will use proceeds for general corporate purposes, which may include expanding its manufacturing capacity. That by itself should have sent shares down. ALSO READ: Famous Restaurant Chains That Are Hard to Find Shutterstock closed last night at $60.32 and priced its offering of 4.6 million shares at $60.00 this morning. The company is selling only 1 million shares; the rest are being sold by some existing shareholders. The underwriters have an option on an additional 690,000 shares. The company said the purpose behind the offering is to increase the company’s public float, among other things. As far as JinkoSolar is concerned, part of the reason for the price jump is almost certainly a short squeeze. Institutional investors also are likely the heaviest buyers as they move toward some momentum stocks to juice up returns. ALSO READ: The Countries with the Most Multimillionaires Shutterstock only had a public float of about 6.5 million shares, so it is likely adding liquidity. The stock is up more than 200% since the company’s IPO, and we can assume that there are real buyers out there who want in on the party. In addition, nearly 13% of the stock is held short, so there is some covering going on as well. Still, it is an interesting turn of events to see shares jump on secondary offerings. Shares of JinkoSolar are trading at $18.43 a few minutes after noon on Friday, in a 52-week range of $3.18 to $20.06. Shutterstock’s shares are up nearly 12% at $67.46, after posting a new 52-week high earlier this morning of $68.42. The 52-week low is the IPO price of $21.00. America's Richest (and Poorest) States The Best Economies in the World Ten Brands That Will Disappear in 2014 Stocks slammed! Official 'correction' looms NCAA fumbles, college football team wants to unionize Super Bowl ad strategy goes bigger than game day The problem with Microsoft's next CEO Keystone review looming, likely to show little climate risk Solar stocks bounce back after analyst says China not cutting target China's 2014 Solar Target Falls Short, Shares Slump Seahawks vs Broncos: which Super Bowl team is Wall … NCAA fumbles, college football team wants to union … Stocks slammed! Official 'correction' looms Bird flu negative for YUM stock: Trader MasterCard's Q4 Revenue Jumps, but Wall Street …,data/hw_hotel_finance/finance\2014_01_31-PM_00_05_12-2.txt"
"Companies Raising Over $3 Billion in New Stock Sales The stock market is looking healthier and healthier again, and it is not just because the S&P 500 is within striking distance of 1,700 and because the DJIA has crossed back over 15,000. We are seeing major ... http://finance.yahoo.com/news/companies-raising-over-3-billion-140056268.html Companies Raising Over $3 Billion in New Stock Sales - Yahoo Finance Companies Raising Over $3 Billion in New Stock Sales September 10, 2013 10:00 AM The stock market is looking healthier and healthier again, and it is not just because the S&P 500 is within striking distance of 1,700 and because the DJIA has crossed back over 15,000. We are seeing major secondary offerings from companies themselves and from their insiders and backers. When companies sell shares it is generally into a strong market. That being said, investors have to sometimes wonder if they want to buy stock when a company wants to sell more stock to the public. 24/7 Wall St. has tracked offerings from and involving the following companies: Armstrong World Industries Inc. ( AWI ); Enbridge Energy Management LLC ( EEQ ), Enbridge Energy Partners L.P. ( EEP ), Inergy Midstream L.P. ( NRGM ), Marketo Inc. ( MKTO ), Starwood Property Trust Inc. ( STWD ), Stratasys Ltd. ( SSYS ) and Virtus Investment Partners Inc. ( VRTS ). Ten Brands That Will Disappear in 2014 What should really stand out here is not just that these combined offerings come to more than $2.4 billion. We did not include several other offerings, and those in total would come up to close to another $1 billion. We have added color and reference on each offering versus its average volume and size. Armstrong World Industries Inc. ( AWI ) has an offering of 10,057,382 common shares held by Armstrong World Industries, Asbestos Personal Injury Settlement Trust and Armor TPG Holdings. Note that the company has agreed to purchase 5,057,382 of the 10,057,382 common shares of this offering at a price per share equal to the price paid by the underwriter. Shares are trading at $52.37, and the 52-week trading range is $43.30 to $58.48. This is some $520 million in gross dollars, or about $250 million if you back out the shares being repurchased. Seven Highly Educated Jobs Making the Least Money Enbridge Energy Management LLC ( EEQ ) has filed to sell 8 million of its listed shares (units). Proceeds will be used to invest in an equal number of i-units of Enbridge Energy Partners L.P. ( EEP ). Enbridge Partners will then use the proceeds to purchase additional shares to repay its commercial paper, to finance a portion of its capital expansion program and for general partnership purposes. The ""Management-EEQ"" units are down 4% at $28.67, against a 52-week range of $25.81 to $32.30. The ""Partners-EEP"" shares closed at $30.20, versus a 52-week range of $26.88 to $33.49. This comes to almost $240 million before the exercise of any overallotment shares (units). Inergy Midstream L.P. ( NRGM ) is trading down by 4.6%, at $22.19 against a 52-week range of $21.03 to $26.01, after filing to sell 11 million common units. The gross proceeds appear to be around $242 million or so. Be advised that the units are being sold by its limited partners. Marketo Inc. ( MKTO ) already has filed to sell 6 million shares of its common stock, with 5.3 million being sold by existing shareholders and Marketo offering about 700,000 shares in the offering. This offering may seem small at about $200 million, but this is right into a lock-up period since its IPO came out in May. Many investors find offerings in bad taste on a ""Sell as immediately as you can,"" but this one did very well since its IPO as well. Starwood Property Trust Inc. ( STWD ) has priced a 25 million share offering of common stock to raise just over $600 million in gross proceeds. The company intends to use the net proceeds to originate and purchase additional commercial mortgage loans and other target assets and investments, and it included the ""for other general corporate purposes"" disclaimer in the release. The $600 million compares to a market cap of about $4.04 billion, while the 25 million shares compares to an average daily volume of about 2 million shares. Apple: What Happens When Everyone Knows About a Product Release? Stratasys Ltd. ( SSYS ) is selling 4 million shares of its ordinary shares, representing close to $400 million in gross proceeds. Its market cap is just over $4 billion, and it trades about 825,000 shares per day on average. Virtus Investment Partners Inc. ( VRTS ) has done incredibly well as a stock, and it has now filed to sell roughly $175 million worth of its common stock. That would be roughly 1 million shares based on the current price, versus an average daily volume of only about 50,000 shares. Virtus has a market cap of $1.37 billion before the impact of this offering. These were just the offerings that we deemed to be of significant value. There were seven or eight other offerings that probably come close to another $1 billion or so in combined size. As a reminder, when companies and insiders sell more stock, those funds to purchase the new shares on the market generally are used in place of what would have otherwise been market-oriented stocks. States Where the Most People Go Hungry The Seven Best Paying Jobs With Only High School Diploma Eleven Countries with Soaring Inflation Personal Investing Ideas & Strategies Stocks slammed! Official 'correction' looms NCAA fumbles, college football team wants to unionize Super Bowl ad strategy goes bigger than game day The problem with Microsoft's next CEO Keystone review looming, likely to show little climate risk Is This the Top for Armstrong World Industries, Inc. (AWI)? 2 Hot Picks in Commercial Construction Seahawks vs Broncos: which Super Bowl team is Wall … NCAA fumbles, college football team wants to union … Stocks slammed! Official 'correction' looms Bird flu negative for YUM stock: Trader MasterCard's Q4 Revenue Jumps, but Wall Street …,data/hw_hotel_finance/finance\2014_01_31-PM_00_05_12-3.txt"
"We're Living in a 'Tech Depression': Andreessen Don't expect a game changing tech IPO anytime soon. Private tech companies are steering clear of going public as long as they can, said Marc Andreessen, the co-founder of the venture capital firm Andreessen ... http://finance.yahoo.com/news/were-living-tech-depression-andreessen-100130066.html We're Living in a 'Tech Depression': Andreessen - Yahoo Finance We're Living in a 'Tech Depression': Andreessen May 14, 2013 6:01 AM Don't expect a game changing tech initial public offering anytime soon. Private tech companies are steering clear of going public as long as they can manage, said Marc Andreessen, the co-founder of the venture capital firm Andreessen Horowitz, on CNBC's ""Closing Bell"" Monday. ""When you say what's the next big IPO, the brutal truth is I don't know and I'm not sure there is going to be one for quite while because the incentives are so strong to keep these companies private,"" Andreessen said. : Software Out, Hardware Start-Ups In ) The hangover felt from the dot-com crash and financial crisis has spurred an era of over regulation in the public markets which has essentially caused a backlash from private companies that are refusing to go public, Andreessen said. Emerging entrepreneurs see the public markets as ""incredibly hostile,"" he said. ""The new running theory among new entrepreneurs is never take your company public or don't do it as long as you possibly can,"" Andreessen said. Andreessen, who has invested in tech companies including, Facebook ( FB ), Twitter, and Pinterest, said that another reason tech companies are hesitant to go public is because of the pain still felt from the dot-com crash. : Facebook in Talks to Buy Israel's Waze: Report ) ""A lot of people got burned during the dot-com crash, so I think we are living through the other side of that, I think we are living through sort of the tech depression, is the term I've used,"" he said. ""But at the same time I can tell you that the vast majority of the interesting new companies that are sort of at the $50 million to $100 million revenue stage,that have historically have been the source of the exciting IPOs that put growth into the market, those companies are quite simply staying private, they aren't going public."" : Signs of Another Tech Bubble: VC ) While there were about 8,800 public companies in 1997, there were about 4,100 publicly traded companies in 2012, a decline that can be contributed to a war being waged on the public markets via regulations like Sarbanes-Oaxley and Regulation FD, which were put in place to help derisk the market. But these regulations do more harm than good, Andreessen said. (Read More Below the Video.) ""We seem to have collectively decided as a society that we want to strip risks out of the public markets, so we had the dot-com crash, we had the financial crisis, and we decided that we don't like risk anymore,"" he said. ""So there have been a series of regulatory reforms, a series of corporate governance movements, and the result has been a huge disincentive for companies to go public, and of course the problem with that is if new companies don't go public then you get exactly what we are seeing, which is the number of public companies falling."" Because the number of public companies is falling, growth is being stripped out of the public markets, which will ultimately pave the way for a two-tiered system, he said. ""If you kill risk, you kill growth. If you kill growth you kill returns. And as a result the market is becoming a two-tiered system and I think that is bad,"" he said. ""Funds like ours-that primarily represent, frankly, rich people, rich people's pensions, rich people's colleges and foreign countries' sovereign wealth funds-generally, are doing fine."" However, he said that on the public side, growth is being drained out of the market, and that could hurt many Americans in the long-term. ""Of course the public market is where most ordinary Americans retirement savings is held in the form of mutual funds and pension funds and if we keep with this approach of over regulation in the public markets, we're not going to have returns for peoples' retirement accounts, which means people aren't going to be able to retire,"" he said. ""And I think that is going to be the big problem that comes out of that and I think that's where we are heading straight towards that right now."" Hedge Fund Manager Loeb Targets Sony for a Breakup BlackBerry CEO Heins Unveils New Mid-Tier Phone Initial Public Offering: CNBC Explains Stocks slammed! Official 'correction' looms NCAA fumbles, college football team wants to unionize Super Bowl ad strategy goes bigger than game day The problem with Microsoft's next CEO Keystone review looming, likely to show little climate risk No Terrible Twos for Facebook stock Google Stock Touches New High As Ad Clicks Climb Seahawks vs Broncos: which Super Bowl team is Wall … NCAA fumbles, college football team wants to union … Stocks slammed! Official 'correction' looms Bird flu negative for YUM stock: Trader MasterCard's Q4 Revenue Jumps, but Wall Street … Copyright © 2013 <a href=""http://us.rd.yahoo.com/finance/news/cnbc/SIG=10otftq0e/*http://www.cnbc.com/"">CNBC</a>. All rights reserved.,data/hw_hotel_finance/finance\2014_01_31-PM_00_05_12-4.txt"
