"Oct 12 2009 	Nice trendy hotel location not too bad.	I stayed in this hotel for one night. As this is a fairly new place some of the taxi drivers did not know where it was and/or did not want to drive there. Once I have eventually arrived at the hotel, I was very pleasantly surprised with the decor of the lobby/ground floor area. It was very stylish and modern. I found the reception's staff geeting me with 'Aloha' a bit out of place, but I guess they are briefed to say that to keep up the coroporate image.As I have a Starwood Preferred Guest member, I was given a small gift upon-check in. It was only a couple of fridge magnets in a gift box, but nevertheless a nice gesture.My room was nice and roomy, there are tea and coffee facilities in each room and you get two complimentary bottles of water plus some toiletries by 'bliss'.The location is not great. It is at the last metro stop and you then need to take a taxi, but if you are not planning on going to see the historic sites in Beijing, then you will be ok.I chose to have some breakfast in the hotel, which was really tasty and there was a good selection of dishes. There are a couple of computers to use in the communal area, as well as a pool table. There is also a small swimming pool and a gym area.I would definitely stay in this hotel again, but only if I did not plan to travel to central Beijing, as it can take a long time. The location is ok if you plan to do a lot of shopping, as there is a big shopping centre just few minutes away from the hotel and there are plenty of eating options around, including restaurants that serve a dog meat! Sep 25 2009 	Great Budget Hotel!	Stayed two nights at Aloft on the most recent trip to China. The hotel was very modern and clean. The room was spotless and a comfortable king sized bed (as far as soft beds go in China). The staff was very punctual and went out of the way to help my every need, including going to a store across the street to purchase a China Mobile SIM card for me. The buffet breakfast was okay, nothing to write home about. The 42” LCD screen had movies on demand for 20RMB and had a good selection of western channels including HBO, CNN, BBC, Star World etc… The gym was small, had a selection of basic weights and one cable machine, there was however 6 new TechnoGym cardio machines with built in LCD TVs which were very good. The location is a bit out of the way to the central areas of Beijing, but it is better suited for my needs as I need to be in the Haidian district. Being SPG Platinum there were no upgrades to a better room, because Aloft has a policy of not doing any upgrades. The Sheraton next door is a much nicer hotel in my opinion (where I am writing this from now, with an upgraded room) but as far as bang for the buck, Aloft is a great place! Aug 4 2009 	Excellent value - location not a big problem.	We stayed at the Aloft Beijing Haidian for 5 nights from July 17 - 22nd. There are lots of reviews that talk about the location being a problem but we knew this ahead of time and found that it really wasn't an issue. The longest we spent in a taxi was about 30 minutes. We never paid more than 50rmb for a taxi ride (which is about $8 Cdn) and that was to the Forbidden City. Given there are 4 in our family, it was no big deal at all.As for the rooms, they were clean, the beds comfortable, the wireless internet connection reliable and it was one of the few hotels we found in Beijing that would accomodate 2 adults and 2 children. We paid about $70 Cdn. per night. That's an amazing price.It's not meant to be a 5 star hotel so you can't go in expecting that. We found the reception staff generally very helpful and friendly. They aren't the fastest in the world but it wasn't unreasonable at all.The hotel manager made an effort to speak with us a few times and was extremely helpful and welcoming. Their breakfast buffet was quite good and reasonably priced. There are a number of good restaurants in the Four Points Sheraton next door so there were lots of options. There is a massive mall about a block away that has other dining options as well.The only issue we ran into was a few taxi drivers refusing to take us to the Summer Palace because I guess they felt it wasn't far enough. The minimum rate is 10rmb. But the staff at the Four Points Sheraton (which is on a busier road than the side street for Aloft) were quite helpful in finding taxis for us if they weren't already there.We would definitely stay there again and recommend it to our friends for its excellent value. Jul 17 2009 	Stylish clean reasonable value poor location	I am glad to be the first person to post photos of this hotel. Key points about this property:- its a starwood property, much cheaper than the rest, and it shows in the pretty incompetent reception staff, the hard bed, the cheap blinds that don't quite block out the sun in the mornings, and common areas which seem to be degrading very quickly (given how new this hotel is).- on the up side, it is very clean and tidy, and if that is important to you, this hotel presents good value. It is also quite stylishly designed and looks much more modern than anything else in this price range.- location is poor for the typical tourist. Yes, very poor. It is not really close to much cheaper the summer palace, and other places will require a taxi, which will probably result in hours of being frustratingly stuck in traffic. Taxi drivers also dont know where it is. If coming from the East, (i.e. city centre or airport) then it is the right turn AFTER the Four Points hotel, which is adjacent. If you are trying to scam an SPG platinum status in the cheapest way possible, perhaps stay in these two adjacent SPG hotels for 25 nights and check out every night.On the whole I thought it was decent value, but dollar for dollar, I would personally prefer to pay double for the Westin in Chaoyang or Financial Street. I have stayed at both at approx. double the price, for real 5 star service. But if thats not in your budget and you want the assurance of an international hotel chain, this hotel is perfect for you.Lastly, this hotel may also be appropriate for university students in Haidian, but don't pick this unless you know what you are doing. Taxis to BLCU or Tsing Hua may be exceptionally frustrating because of constant traffic around Zhong guan cun street. Tell taxi drivers to go on the four ring road, even though it might be a bit more expensive.There is free internet, but it does not seem to work with iPhones. May 30 2009 	Remote but excellent value for money	Stayed there for one night. The hotel is located in Haidian, which is a little bit remote. But if you don't mind taking the taxi to the closest subway station, which costs only 15-20 CNY a ride the hotel represents excellent value for money given its low prices and the modern, quiet and very clean rooms. Also internet use is for free. Especially for travellors who don't want to spend the money for a Hyatt or Hilton but who look for a very decent place to stay this hotel represents an excellent choice. Dec 31 2008 	Good value but not downtown	This hotel is located next to the Four Points Hotel and are both part of the Starwood group. For those wanting a downtown location, this property may not be for you - I recommend factoring in taxi fares in and out of town when working out the value here. On the otherside, the rates for the hotel are very good and the rooms are basic but well appointed. TV was more focused on local channels which may be an indication of the clients they are targeting. There was however the standard HBO, BBC, etc. Staff were very friendly and check in and check out times were acceptable. Jul 20 2009 	???????????????????"
"VERY NICE HOTEL	We get vacation every year after my wedding. But up to now more than four years we work hard and prepare for great vacation for 4 months we choose Asia is our destination First stop in Beijing we stayed in this hotel.Hotel not too big but the room was nice and comfortable. We liked this and enjoyed it. Nov 19 2009 	A fantastic hotel	My boyfriend and I stayed in the Autumn Garden hotel at the end of our trans-siberian railway trip from Moscow and staying there was one of the highlights of an amazing holiday. Staying in the hutong was so much better than an international style hotel, we really felt that we experienced a 'real' bit of Beijing. We loved the choice of english or chinese breakfasts, the room was gorgeous and having free internet was incredibly useful. The location was wonderful too, only 10 minutes walk to Tiananmen square. Sep 11 2009 	nice place to stay	The staff are extremely helpful and friendly, enabling you to find your bearings by providing a trishaw facility to the main road from the hotel. The location of the hotel is a 5 minute walk from Qianmen subway and the furnishings of the hotel rich in tradition. You may not get the western breakfasts you do in more modern hotels but it gives you an opportunity to live like the locals. Dec 14 2008 	Reccomended	This is a great little hotel, I booked this hotel based on previous reviews, so I thought I would come on here and recommend it myself.I went to Beijing on my own for 4 nights to see what its like. It is quite a crazy place, Chinese people seem to take advantage of tourists at every possible opportunity.The Autumn Garden Hotel however is amazing, such nice people, and I consider it a great price for what I got. Its location is great if you want to get a slight feel of what its like living in China.You need to walk down a couple of narrow alley ways to get to the Hotel, but it is very close to Tienanmen Square, with a lot of sites close by, such as the Temple of Heaven and Forbidden City within walking distance. Also there is a touring company with nice and cheap tours (although in Chinese) which is less than 10 minutes walk away next to Tienanmen Square.The rooms are clean and comfortable. Breakfast is simple but decent. The People are fantastic, talk English and are very very helpful. They picked me up from the airport without any charge, Im not sure if this is a regular service, but it was helpful. If it is your first time in China, I recommend getting picked up, as taxi drivers talk very little English if any at all, and the Hotel can be hard to find, Taxi drivers wont know it.The hotel welcomes you very nicely, and give you a map to the area and to the hotel, and even a mobile phone to use while you stay with them.The hotel had everything you should need, but I was truly impressed by the service there which easily allows me to recommend it. In contrast to most of the Chinese which I met who seemed to try and take me for every cent that I had, this little hotel was there for me for every need, without trying to charge me for the help that they offered, or even the things which I expected to pay for such as the half a day late checkout, or airport pick up.If you want a simple, relaxing, and friendly stay, try the Autumn Garden. I will no doubt be staying there again on my next visit. Nov 10 2008	an oasis in Beijing	Just got back from Beijing and a wonderful experience staying in the middle of a hutong (maze of alleyways) in Beijing, just next door to Tian'anmen Square. This inn is truly an oasis in a crazy busy city and right in the middle of what feels like 50 years ago - staff were so welcoming and accomodating - if you want a taxi, they have one - we went to the Great Wall with our very own driver - even had a (very simple) lunch prepared by one of the staff - who were all delightful - lovely courtyard - very quiet even though in the midst of chaos - a real feel for old China - haven't downloaded our photos yet, but willing to share if anyone is interested! Nov 1 2008 	Lovely traditional style hotel	This is a really lovely traditional style hotel, located literally just 5 minutes walk away from Tianmen square as well as lots of eating options &amp; shops. The girls at the front desk were very friendly, helpful and spoke good english. The rooms are very pretty and comfortable, with modern western style bathrooms. Since it's located in the hutong (lots of narrow, confusing alley ways) It's a good idea to take with you the address of the hotel writen in Chinese characters as well as the phone number, so the taxi driver can call for directions. We were given a mobile to use during our stay - and took it with us when we went off to North Korea for a week and then called when we got back, and they sent out a car to pick us up from the station. On our return we also got upgraded to a bigger room. The bathrooms were pretty much the same in both rooms - the sinks make a brilliant nose when you tap them. I booked, as I usually do, on www.venere.com - this is an excellent website and no down payment required. Aug 25 2008 	Living it the Beijing way	As I was looking for accommodation for my visit during the Olympics in late 2007, most of the major hotels were not available for booking for IOC-related room blocks. Which means when I booked it everything everywhere was very expensive. Then I found this little courtyard hotel, and was charged at least 4 times their published rates, yet still I am happy with what I got. Situated 3 &quot;layers&quot; deep from the main streets, you will either need to have good map reading skills to navigate your way to find this on your own... or you could use their free tricycle service which would pick you up from either Qianmen or Hepingmen Quanjude Roast Duck Restaurant.I love the surrounding of this guesthouse. It is a typical hutong where houses are one next to the other, and rather peaceful and quiet. That means it's not the best place to stay if you are expecting upper class and polished streets. In fact, you will find at least 3 smelly public toilets along the way to the guesthouse. But that's what's genuine about the neighbourhood. The location is also quite fantastic... a 5-10 minute walk (or less with tricycle) would bring you to the subway station (Hepingmen and Qianmen), and also Tiananmen Square... that's a big plus for those who like to travel the local way (on foot or subway).Rooms are not big, but adequate, with modern bathroom amenities (good and strong hot showers!). Room rates include free use of internet and breakfast (Chinese or western style, pick whatever you want).You cannot reach this place by taxi, so be ready to have a little hassle when you arrive and depart. The tricycle rider is friendly and could get you to the main streets. I arrived in a chauffeured car and the driver had no clue where it was and luckily I did my research and found the property myself. Although I paid the rate for a 5-star hotel, I wouldn't have done it any other way."
"Dec 24 2007 	Nice property	We booked a three bedroom room for $92/nite, each room came with a queen size bed. Also included was a kitchen with frig and microwave, and a washer dryer. There was also a dining area and living room, where we could sit down at night and go over all the booty collected in a days shopping. While the rooms were very spartan and lacked color, the room was very clean. The location is great and I would highly recommend this hotel to everyone, except Leon Helmsley, who would probably prefer the Astoria. Sep 15 2006 	Great hotel for large groups! (and individuals...)	I traveled to Beijing in June 2006 with 6 friends and we needed an inexpensive hotel that would hold our large group. The Century Towers Beijing hotel was PERFECT. We made a reservation through www.sinohotel.com, which I was nervous about at first, not being familiar with them. The customer service reps were fantastic, responding to all my spastic e-mails quickly and with great care. When we arrived at the Hotel, we breezed through check-in and were given the same price quoted on SinoHotel.com so there were no $$ issues. We stayed in a 3-bedroom apartment-style space (the &quot;large&quot; version offered on the website), with 2 full bathrooms (American Standard fixtures) a full kitchen, and a dining room. It even included a washer/dryer in the unit, though we didn't have any need to use it. The apartment was very clean, air-conditioned, and spacious, even with the 7 of us, we had plenty of room to relax! The hotel is across the street from a HUGE supermarket, so we ended up cooking most breakfasts in the room, saving even more money! We kept lots of cold bottled water in the fridge to take with us on our adventures in the hot, dry summer weather of Beijing. The room included a large flat-screen TV in the living room with cable, and a few English-language channels like the BBC (and the Simpsons!)Other really nice aspects of the hotel include a work-out room in the basement with treadmills, stationary bikes, a rowing machine, ballet bar, free weights, and weight machines. The hotel restaurant is very small but serves good food. The wait staff (and most of China) speak very little English, so learn basic Chinese phrases and expec to smile and point a lot :) We are traveling to Shanghai in the Summer of 2007 and if Century Towers has a location there, we would absolutely stay again! I think the price is much cheaper at this hotel because it's a Chinese hotel, not a foreign chain. We paid about $85 USD/night for this large 3 bedroom apartment-style room. Between the 7 of us, the price was certainly right!"
